{
  "report_version": "2.0.0",
  "report_id": "elevadr-20260929T035005Z-4321a108",
  "executive_summary": {
    "analysis_summary": "Analyzed 01_mixed_ot_baseline.pcap with 60 detector modules and produced 5 detector finding(s).",
    "device_summary": "Observed 5 host(s), including 2 OT-classified host(s).",
    "service_summary": "Observed 4 distinct service name(s) across 4 connection record(s)."
  },
  "modules": {
    "service_panel": {
      "num_known_services": 4,
      "num_ot_services": 1,
      "num_risky_services": 6,
      "num_unknown_services": 0
    },
    "device_panel": {
      "hosts": 5,
      "ot_hosts": 2,
      "it_hosts": 3,
      "edge_hosts": 0,
      "ot_cross_segment": 2
    },
    "service_risk_breakdown_panel": {
      "risk_category_counts": {
        "medium": 1,
        "high": 3,
        "low": 2
      },
      "risk_category_services": {
        "medium": [
          "HTTP"
        ],
        "high": [
          "Modbus/TCP",
          "http",
          "modbus"
        ],
        "low": [
          "dns",
          "ntp"
        ]
      }
    },
    "service_count_panel": {
      "service_count": 4,
      "service_connections_count": {
        "known_services": [
          {
            "name": "dns",
            "port": 53,
            "count": 1
          },
          {
            "name": "http",
            "port": 80,
            "count": 1
          },
          {
            "name": "modbus",
            "port": 502,
            "count": 1
          },
          {
            "name": "ntp",
            "port": 123,
            "count": 1
          }
        ],
        "unknown_services": {}
      }
    },
    "connection_success_panel": {
      "summary": {
        "successful_count": 4,
        "unsuccessful_count": 0,
        "by_state": {
          "SF": 4
        }
      },
      "connections": [
        {
          "src_endpoint.ip": "10.10.0.10",
          "src_endpoint.port": 53000,
          "dst_endpoint.ip": "10.10.0.53",
          "dst_endpoint.port": 53,
          "service.name": "dns",
          "connection_info.protocol_name": "udp",
          "connection_info.direction_name": null,
          "duration": 1.0,
          "orig_bytes": 50,
          "resp_bytes": 90,
          "state": "SF",
          "history": "ShADadFf",
          "success": true
        },
        {
          "src_endpoint.ip": "10.10.0.10",
          "src_endpoint.port": 51000,
          "dst_endpoint.ip": "10.10.0.123",
          "dst_endpoint.port": 123,
          "service.name": "ntp",
          "connection_info.protocol_name": "udp",
          "connection_info.direction_name": null,
          "duration": 1.0,
          "orig_bytes": 48,
          "resp_bytes": 48,
          "state": "SF",
          "history": "ShADadFf",
          "success": true
        },
        {
          "src_endpoint.ip": "10.10.0.10",
          "src_endpoint.port": 40000,
          "dst_endpoint.ip": "10.20.0.20",
          "dst_endpoint.port": 502,
          "service.name": "modbus",
          "connection_info.protocol_name": "tcp",
          "connection_info.direction_name": null,
          "duration": 1.0,
          "orig_bytes": 12,
          "resp_bytes": 13,
          "state": "SF",
          "history": "ShADadFf",
          "success": true
        },
        {
          "src_endpoint.ip": "10.10.0.10",
          "src_endpoint.port": 40001,
          "dst_endpoint.ip": "10.20.0.30",
          "dst_endpoint.port": 80,
          "service.name": "http",
          "connection_info.protocol_name": "tcp",
          "connection_info.direction_name": null,
          "duration": 1.0,
          "orig_bytes": 90,
          "resp_bytes": 66,
          "state": "SF",
          "history": "ShADadFf",
          "success": true
        }
      ]
    },
    "suspicious_outbound_connections_panel": [],
    "ot_cross_segment_lines_panel": {
      "lines": [
        {
          "src_endpoint.ip": "10.10.0.10",
          "dst_endpoint.ip": "10.20.0.20",
          "dst_endpoint.port": 502,
          "service.name": "modbus",
          "count": 1
        },
        {
          "src_endpoint.ip": "10.10.0.10",
          "dst_endpoint.ip": "10.20.0.30",
          "dst_endpoint.port": 80,
          "service.name": "http",
          "count": 1
        }
      ],
      "subnet_pair_counts": [],
      "dst_subnet_counts": [],
      "ot_device_counts": []
    },
    "ot_devices": [
      {
        "manufacturer": null,
        "mac": "02:00:00:00:20:20",
        "ip_addresses": [
          "10.20.0.20"
        ],
        "ipv4_ips": [
          "10.20.0.20"
        ],
        "ipv6_ips": [],
        "subnets": [
          "10.20.0.0/24"
        ],
        "ipv4_subnets": [
          "10.20.0.0/24"
        ],
        "ipv6_subnets": [],
        "incoming_services": [
          "modbus"
        ],
        "sent_services": [],
        "is_ot": true,
        "is_edge": false
      },
      {
        "manufacturer": null,
        "mac": "02:00:00:00:20:30",
        "ip_addresses": [
          "10.20.0.30"
        ],
        "ipv4_ips": [
          "10.20.0.30"
        ],
        "ipv6_ips": [],
        "subnets": [
          "10.20.0.0/24"
        ],
        "ipv4_subnets": [
          "10.20.0.0/24"
        ],
        "ipv6_subnets": [],
        "incoming_services": [
          "http"
        ],
        "sent_services": [],
        "is_ot": true,
        "is_edge": false
      }
    ],
    "it_devices": [
      {
        "manufacturer": null,
        "mac": "02:00:00:00:10:10",
        "ip_addresses": [
          "10.10.0.10"
        ],
        "ipv4_ips": [
          "10.10.0.10"
        ],
        "ipv6_ips": [],
        "subnets": [
          "10.10.0.0/24"
        ],
        "ipv4_subnets": [
          "10.10.0.0/24"
        ],
        "ipv6_subnets": [],
        "incoming_services": [],
        "sent_services": [
          "dns",
          "http",
          "modbus",
          "ntp"
        ],
        "is_ot": false,
        "is_edge": false
      },
      {
        "manufacturer": null,
        "mac": null,
        "ip_addresses": [
          "10.10.0.123"
        ],
        "ipv4_ips": [
          "10.10.0.123"
        ],
        "ipv6_ips": [],
        "subnets": [],
        "ipv4_subnets": [],
        "ipv6_subnets": [],
        "incoming_services": [
          "ntp"
        ],
        "sent_services": [],
        "is_ot": false,
        "is_edge": false
      },
      {
        "manufacturer": null,
        "mac": null,
        "ip_addresses": [
          "10.10.0.53"
        ],
        "ipv4_ips": [
          "10.10.0.53"
        ],
        "ipv6_ips": [],
        "subnets": [],
        "ipv4_subnets": [],
        "ipv6_subnets": [],
        "incoming_services": [
          "dns"
        ],
        "sent_services": [],
        "is_ot": false,
        "is_edge": false
      }
    ],
    "edge_devices": [],
    "ot_services": [
      {
        "service.name": "modbus",
        "service.description": "Observed OT/ICS service",
        "service.information_categories": "control",
        "service.risk_categories": "detector_observed"
      }
    ]
  },
  "arch_insights": {
    "detector_results": [
      {
        "module_id": "cleartext_credentials",
        "findings": [],
        "metrics": {
          "cleartext_credential_events": 0,
          "unique_credential_exposures": 0,
          "events_by_protocol": {}
        },
        "evidence": {
          "inspected_logs": [
            "http"
          ],
          "skipped_logs": [
            "ftp",
            "smtp",
            "telnet",
            "login"
          ],
          "supported_protocols": [
            "ftp",
            "http",
            "smtp",
            "telnet"
          ],
          "supported_logs": [
            "ftp",
            "http",
            "smtp",
            "telnet",
            "login"
          ],
          "passwords_redacted": true,
          "coverage_notes": {
            "ftp": "Direct username/password detection when Zeek FTP password capture is enabled.",
            "http": "Direct HTTP Basic Authentication detection when Zeek HTTP password capture is enabled.",
            "smtp": "Detects explicit credential fields from enriched/custom SMTP analysis; standard smtp.log alone does not expose AUTH passwords.",
            "telnet": "Detects explicit credential fields from Telnet/login analysis; modern Zeek does not enable the legacy login credential analyzer by default."
          }
        },
        "warnings": []
      },
      {
        "module_id": "deprecated_insecure_services_protocols",
        "findings": [
          {
            "title": "Deprecated or insecure service observed: HTTP",
            "severity": "medium",
            "summary": "Observed 1 flow(s) associated with HTTP. HTTP does not provide transport encryption; sensitive application data should use HTTPS/TLS.",
            "confidence": "high",
            "detection_basis": "protocol_log",
            "devices": [
              "10.10.0.10",
              "10.20.0.30"
            ],
            "services": [
              "HTTP"
            ],
            "ports": [
              80
            ],
            "connection_pairs": [
              {
                "source": "10.10.0.10",
                "destination": "10.20.0.30",
                "port": 80,
                "protocol": "tcp",
                "service": "HTTP"
              }
            ],
            "flows": [
              {
                "timestamp": 1760000000.4,
                "uid": "C4",
                "source_ip": "10.10.0.10",
                "source_port": 40001,
                "destination_ip": "10.20.0.30",
                "destination_port": 80,
                "protocol": "tcp",
                "service": "http",
                "duration": 1.0,
                "source_bytes": 90,
                "destination_bytes": 66,
                "zeek_state": "SF",